{
  "schemaVersion": "1.0",
  "eventId": "evt:523-14",
  "seq": 14,
  "timestamp": "2026-08-20T12:00:00Z",
  "eventType": "graph.revision.created.v1",
  "source": "incremental-indexer",
  "producer": "archctl",
  "correlationId": "corr:task-83",
  "causationId": "evt:filechange-13",
  "graphRevision": 523,
  "payload": {
    "changedFiles": [
      "src/payment.rs"
    ]
  }
}
